{
  "audit": {
    "created_at": "2026-05-17T23:49:46.082750Z",
    "input_hash": "a67595a32c06e524d73b19fe9a4e95d1808612b0717b2a99f5eecf12dc729fed",
    "policy_hash": "ab2f75110044913bcd155ad800ff1ae83c0e22d6d7a612420745f98001c5eb9c",
    "replayable": true,
    "response_hash": "c32b599951d7e0a853f20e22f430d3225d7a8a505210d5b8e3d31e15b39011cc",
    "trace_id": "bridge_cc05f26a02e06b48"
  },
  "consumer_id": "codex-shadow",
  "contract_version": "1.0.0",
  "degradation": {
    "degraded": true,
    "reason_codes": [
      "sqlite_vec_unavailable_using_json_vector_fallback"
    ]
  },
  "error": null,
  "operation": "health",
  "policy_decision": {
    "allowed": true,
    "clamps": {},
    "reason_codes": []
  },
  "record_type": "muninn_v2_bridge_response",
  "request_id": "sindri-health",
  "result": {
    "adaptive_scoring_default": false,
    "bridge_version": "muninn-v2-bridge/1.0.0",
    "cards_available": 26,
    "db_readable": true,
    "index_status": {
      "backend": "json_vector_fallback",
      "backend_available": true,
      "degraded": true,
      "eligible_records": 26,
      "indexed_records": 26,
      "missing_records": 0,
      "reason": [
        "sqlite_vec_unavailable_using_json_vector_fallback"
      ],
      "stale_records": 0
    },
    "policy_consumer_id": "codex-shadow",
    "policy_loaded": true,
    "schema_available": true
  },
  "schema_version": "BridgeResponseV1",
  "status": "ok"
}
